{
  "schemaVersion": 2,
  "algorithm": "ed25519",
  "keyId": "279aff591d2627ed",
  "payload": "ewogICJzdGF0ZW1lbnRWZXJzaW9uIjogMiwKICAia2luZCI6ICJzY2VuZSIsCiAgInNsdWciOiAidGhyZWUtc2NlbmUiLAogICJpZCI6ICJkZW1vLnRocmVlLXNjZW5lIiwKICAidmVyc2lvbiI6ICIxLjAuMCIsCiAgImRpZ2VzdCI6IHsKICAgICJhbGdvcml0aG0iOiAic2hhMjU2IiwKICAgICJzY29wZSI6ICJwYWNrYWdlIiwKICAgICJ2YWx1ZSI6ICJmYmFkMjU5YmY4YmJkYzNmODIyYWE1MzUzM2Q0MzI1YjRkNmE4MmQ3ZjVlNzUxNDcxMThjYzk3NTgyNzQ5NmU4IgogIH0sCiAgInNpZ25lZEJ5IjogewogICAgImtleUlkIjogIjI3OWFmZjU5MWQyNjI3ZWQiLAogICAgImFsZ29yaXRobSI6ICJlZDI1NTE5IgogIH0sCiAgInJlbGVhc2VTZXEiOiA0LAogICJzaWduZWRBdCI6ICIyMDI2LTEwLTI4VDA5OjIwOjMwWiIKfQo=",
  "signature": "+K1oD6xvjdzGR5P1czwvqU3oOoKsujyY7LVAg5kYUj2MNz4yEpmzPB0Q1pjN/Bmssr5hGgYHDM7RUhHfGQWFAw=="
}
